Assay,Curie,Definition
lead optimization assay,BAO:0000538,Assays performed in the lead optimization stage. They are typically concentration-response high quality assays. They can involve a number of different assays depending on the required profile of the desired lead compound.
lipophilicity assay,BAO:0010241,
Liquid Chromatography/Mass Spectroscopy (LC/MS) protein quantification,BAO:0010071,
localization assay,BAO:0002196,
low throughput screening,BAO:0010076,
luciferase enzyme activity assay,BAO:0002735,
luciferase reporter gene assay,BAO:0002661,
mass spectrometry,BAO:0000055,"This method is used to detect compounds that are bound to the protein targets. The unbound compounds are separated by affinity based, size exclusion, or ultrafiltration methods. The bound compounds are eluted from the protein and detected by mass spectrometry. Based on the separation method, the throughput varies: between 200-2700 compounds can be loaded in each run for separation._x000D_
Mass spectrometry is used to determine the chemical structure of molecules. The samples are vaporized, followed by ionization and then the mass to charge ratio of the particles is analyzed."
medium throughput screening,BAO:0010075,
meiotic cell cycle state assay,BAO:0002585,
membrane permeability assessment,BAO:0000167,"Live cells with intact membranes have the ability to exclude dyes that easily penetrate dead or damaged cells. Examples of the dyes include propidium iodide, 7-amino actinomycin D, and trypan blue. Cells stained with the former two can be quantified by flow cytometry, while the latter is by manual counting using hemocytometer.   "
membrane potential assay,BAO:0002996,This reports the membrane potential of a cell by using electrophysiological techniques or by staining with dyes whose binding is dependent on the membrane potential.
metabolic stability assay,BAO:0010095,
metabolomic assay,BAO:0010040,Assays that identify and quantify cell metabolites (metabolic analytes)
metabolomic profiling assay,BAO:0010042,Assays that profile key metabolomic parameters
metastasis assay,BAO:0002535,
microsomal stability assay,BAO:0010006,"A common in vitro ADME assay that tests the stability of compounds when incubated with liver microsomes (subcellular fractions which contain membrane-bound drug-metabolizing enzymes).  Assay is used to measure in vitro intrinsic clearance or to identify metabolites formed. Typically liver microsomes from one or more mammalian species (mouse, rat, dog, monkey, human) are analyzed to understand differences in metabolism. Can be reported as % recovery after a set time (single timepoint), or as half-life (multiple timepoints)."
Migration Assay,NCIT:C19425,An in vitro assay in which cultured cells are monitored and analyzed for their ability to move into an acellular area of a culture material.
mitochondrial membrane potential assay,BAO:0002190,
mitochondrial membrane potential assessment,BAO:0000423,"Activity of the mitochondrial respiratory chain results in the generation of a proton gradient which consists of two components: a membrane potential and a pH gradient. Disruption of delta-psi has been shown to be one of the first intracellular changes following the onset of apoptosis. Delta-psi is generally quantitated by staining with specific dyes whose binding is dependent on the potential and less commonly, by electrophysiological techniques."
mitosis/apoptosis assay,BAO:0010004,
mitotic cell cycle state assay,BAO:0002584,"involves biological process' some 'mitotic cell cycle arrest' _x000D_
_x000D_
_x000D_
'involves biological process' some 'mitotic cell cycle arrest' and 'apoptotic process'"
MS protein quantification assay,BAO:0010061,
MS protein state assay,BAO:0010062,
neurite outgrowth assay,BAO:0002803,
optical microscopy,BAO:0000451,Optical or light microscopy involves passing visible light transmitted through or reflected from the sample through a single or multiple lenses to allow a magnified view of the sample
organism behavior assay,BAO:0002765,
other pharmacokinetic studies,BAO:0010226,
oxidative phosphorylation assay,BAO:0002181,
oxidative stress assay,BAO:0002168,
oxidoreductase activity assay,BAO:0002792,
parental cell line assay,BAO:0000647,This assay is performed with the unmodified or parental cell line instead of the one modified with a DNA construct that was used in primary or confirmatory assays.
patch clamp,BAO:0000062,"The patch clamping technique is refined from the voltage clamp technique, wherein a blunt electrode is placed on the surface of the cell membrane. It is a common intracellular recording technique in electrophysiology that allows either the measurement of current passing through individual ion channels in cells or through whole cells. Suction is applied via the blunt electrode (glass pipette in classical patch clamp technique) to create a high resistance (gigaohm) between the electrode and cell surface. This seal isolates the ion channels within the patch from the rest of the membrane and allows the neurophysiologist to record only from these ion channels."
PD biomarker assay,BAO:0010270,
permeability assay,BAO:0010083,
pH stability assay,BAO:0010244,
pharmacodynamic assay,BAO:0002183,
pharmacokinetic assay,BAO:0002182,
Pharmacology: Pharmacodynamic Drug Interactions,NCIT:C79367,
Pharmacology: Primary Pharmacodynamics,NCIT:C79364,
Pharmacology: Secondary Pharmacodynamics,NCIT:C79365,
phosphatase activity assay,BAO:0002762,
phosphorylation assay,BAO:0003005,"This assay quantifies the phosphorylation levels of a protein. The phosphorylation status is detected by one of several methods: using phosphorylation specific antibodies followed by western blotting or imaging, mass spectrometry, etc.|detect some (protein phosphorilation and ('catalyzed by' some kinase))"
physicochemical assay,BAO:0010009,"Physicochemical assays measure inherent properties of molecules, and include turbidimetric and thermodynamic solubility (in water or PBS), chemical stability, pKa, and lipophilicity (logP and logD)"
plasma protein binding assay,BAO:0010135,
plasma stability assay,BAO:0010007,"A common in vitro ADME assay that tests the stability of compounds when incubated with plasma.  Assay is used to measure stability of new chemical entities in plasma, as compounds that rapidly degrade in plasma generally show poor in vivo efficacy. Typically lplasma from one or more mammalian species (mouse, rat, dog, monkey, human) are analyzed. Can be reported as % recovery after a set time (single timepoint), or as half-life (multiple timepoints)."
posttranslation modification assay,BAO:0003004,"This assay quantifies the modification that a protein can undergo after it is synthesized by translation. E.g. phosphorylation, acetylation, etc. The modification status is detected by one of several methods such as using modification specific antibodies followed by western blotting, imaging; mass spectrometry, etc."
preclinical development stage,BAO:0010025,"Assays performed in the pre-clinical development stage. These are assays on a lead candidate to develop it to an Investigative New Drug (IND). This stage typically includes both in vitro and in vivo assays, including thorough PK/PD profiling, toxicity, and in vivo dosing/ formulation optimization for efficacy."
primary assay,BAO:0000031,"The first assay performed in a in a screening campaign. The purpose of the primary assay is to identify hits, which are potentially biologically active chemical entities. Generally in this assay, the perturbagens are tested at a single concentration with only one measurement. It is followed by a confirmatory screen, which can be run at a single concentration with multiple replicates or as concentration-response assay."
protease activity assay,BAO:0002764,
protein expression assay,BAO:0010252,
protein folding assay,BAO:0002998,"This assay quantifies the protein folding/conformation using technologies, such as nuclear magnetic resonance, circular dichroism are used to determine the protein folding/conformation."
protein profiling assay,BAO:0010026,Protein profiling assays can be used to identify and quantify proteins together with their post-translational modifications
protein redistribution assay,BAO:0000378,"Cellular signaling can bring about the movement of proteins in cells. Upon receiving a cue, proteins undergo posttranslational modifications, e.g. phosphorylation, dephosphorylation, etc, which results in their activation and migration to different compartments, often to the nucleus, where they regulate gene expression.|Add a relation between this class and immunoassay using a new object property 'is detected by'."
protein stability assay,BAO:0002804,
protein unfolding assay,BAO:0002779,
protein-protein interaction assay,BAO:0002990,"It is performed to quantify the interactions between two protein molecules, using methods such as protein fragment complementation assay, immunoassay, radioligand binding, etc."
protein-small molecule interaction assay,BAO:0000110,"It is an interaction between a protein (e.g., receptor, transcription factor) and small molecule (e.g., hormone, organic compound with a low molecular weight (<800 Da))."
protein-turnover assay,BAO:0003010,"This assay quantifies the protein turnover, which is a natural phenomenon in healthy cells, but becomes aberrant in diseased cells. The protein that is needed to be degraded first undergoes ubiquitinated. Ubiquitinated proteins are degraded in the proteasome complex. The protein degradation is quantitated by using reporters, such as green fluorescent protein as proteasome substrates.  "
quantitative PCR,BAO:0003031,
quantitative reverse transcription PCR,BAO:0002090,Quantitative reverse transcription PCR is a PCR technique used to determine the amount of cDNA in a sample. It is the most commonly used form of quantitative PCR (qPCR). This technique is also called real-time reverse transcription PCR.
real-time PCR ,BAO:0002084,"In molecular biology, real-time polymerase chain reaction, also called quantitative real time polymerase chain reaction (Q-PCR/qPCR) or kinetic polymerase chain reaction, is a laboratory technique based on the PCR, which is used to amplify and simultaneously quantify a targeted DNA molecule. It enables both detection and quantification (as absolute number of copies or relative amount when normalized to DNA input or additional normalizing genes) of one or more specific sequences in a DNA sample."
receptor induction assay,BAO:0010144,
receptor internalization assay,BAO:0010093,
redistribution assay,BAO:0002999,"It is performed to measure the redistribution of organelles and molecules within the cell (proteins, second messengers, metal ions, dyes, etc. ). This is visualized by microscopy. "
reporter gene assay,BAO:0003006,"Reporter gene assay measures the gene expression from a reporter gene. The reporter gene is inserted under the control of a foreign promoter or an artificial regulatory element of interest. Reporters include luciferase, beta galactosidase, beta lactamase, chloramphenicol acetyl transferase, or a fluorescent protein.|reports some _x000D_
('gene expression' and ('has part' some 'reporter gene'))_x000D_
needs clean up to say has part gene with role of reporter."
reverse transcription PCR,BAO:0002089,"Reverse transcription polymerase chain reaction (RT-PCR) is a variant of PCR in which the RNA strand is first reverse transcribed into its DNA complement (complementary DNA, or cDNA) using the enzyme reverse transcriptase, and the resulting cDNA is amplified using traditional or real-time PCR."
RNA-seq gene expression profiling assay,BAO:0010045,An assay that uses NGS (Next Generation Sequencing) to quantify the expression of the entire RNA transcripts in a cell / cell population
safety pharmacology assay,BAO:0002533,
sandwich ELISA,BAO:0002421,"The sandwich ELISA measures the amount of antigen between two layers of antibodies. The antigens to be measured must contain at least two antigenic sites, capable of binding to antibody, since at least two antibodies act in the sandwich. So sandwich assays are restricted to the quantitation of multivalent antigens such as proteins or polysaccharides. Sandwich ELISAs for quantitation of antigens are especially valuable when the concentration of antigens is low and/or they are contained in high concentrations of contaminating protein."
SAR by NMR,BAO:0002412,
scanning electron microscopy,BAO:0000454,"Scanning electron microscopy (SEM) visualizes details on the surfaces of cells and particles and gives a very nice 3D view. It gives results much like those of the stereo light microscope, and, akin to that, its most useful magnification is in the lower range than that of the transmission electron microscope."
second messenger assay,BAO:0003007,"This assay quantifies the second messengers (calcium, cAMP, cGMP) produced in the cell as a result of a signaling event."
secondary assay,BAO:0000032,"Additional assays following the confirmatory stage to confirm the biological activity of chemical entities via a different type of assay or to eliminate certain active compounds based on their mechanism of action, toxicity or activity profile.  Secondary assays can also include selectivity and specificity assays."
selectivity assay,BAO:0000478,Assay employed to elucidate the specificity of biologically active chemical entities towards one or more targets that are (closely) related to the (intended) primary target.
shotgun MS protein profiling assay,BAO:0010027,An assay that is used to identify in a data-dependent mode proteins by combining the HPLC and MS methods. It is also known as liquid chromatography-coupled tandem mass spectrometry (LC-MS)
signal transduction assay,BAO:0003002,This assay measures one of the series of events that are downstream to the receipt of a chemical signal at the cell
signaling pathway assay,BAO:0010251,
simulated gastric fluid stability assay,BAO:0010104,
simulated gastric fluid stability assay (with enzymes),BAO:0010105,
simulated interstitial fluid stability assay,BAO:0010110,
simulated intestinal fluid stability assay,BAO:0010108,
simulated intestinal fluid stability assay (with enzymes),BAO:0010107,
solubility assay,BAO:0010010,A physicochemical assay that measures the maximum solubility of a molecule in a particular solvent (typically water or PBS).
surface plasmon resonance,BAO:0000054,"For surface plasmon resonance measurements, target protein is immobilized onto a solid surface via covalent or noncovalent interaction. Binding of small molecule compounds changes the refractive index of the immobilized target, which can be detected by optical sensing. Shift in wavelength of light is proportional to mass changes near the sensor surface, with sensitivity to detect mass change being ~300 Da."
SWATH MS protein profiling assay,BAO:0010028,Sequential window acquisition of all theoretical mass spectra (SWATH) MS is a mass spectrometrical method thatcouples data-independent acquisition is coupled with peptide spectral library match
SWATH-MS protein quantification assay,BAO:0010066,
target engagement assay,BAO:0010259,
targeted epigenetic assay,BAO:0010032,Assays that measure a targeted and predetermined subset of the epigenetic modifications in a cell
targeted metabolomic assay,BAO:0010041,
targeted transcriptional assay,BAO:0010044,Assays that quantify the expression of a predetermined RNA transcript / set of transcripts
T-cell activation assay,BAO:0010253,
T-cell cytotoxicity assay,BAO:0010262,
thermal shift assay,BAO:0010261,
thermodynamic solubility assay,BAO:0010246,
time resolved fluorescence resonance energy transfer,BAO:0000004,"Time resolved-fluorescence resonance energy transfer (TR-FRET) unites TRF (Time-Resolved Fluorescence) and FRET (Fluorescence Resonance Energy Transfer) principles. This combination brings together the low background benefits of TRF with the homogeneous assay format of FRET. Introducing a time delay (50-150 micro seconds) between the system excitation and fluorescence measurement allows the signal to be cleared of all non-specific short lived emissions. TR-FRET uses lanthanide donors which are fluorophores with long emission half-lives._x000D_
    _x000D_
"
tissue distribution assay,BAO:0002532,"An assay to determine tissue distribution of a compound after administration via different routes (e.g., p.o., i.v., i.p.)"
tissue homogenate stability assay,BAO:0010111,
toxicity assay,BAO:0002189,
transcriptional profiling assay,BAO:0002995,"This assay quantifies the expression level of the entire gene pool in a cell or a subpopulation (e.g. tissue-specific gene expression, kinases) using a bead-based method."
transmission electron microscopy,BAO:0000455,"Transmission electron microscopy (TEM) is quite similar to the compound light microscope, by sending an electron beam through a very thin slice of the specimen. The resolution limit in 2005 was approximately 0.05 nanometer and has not increased appreciably since that time."
turbidimetric solubility assay,BAO:0010247,
whole blood stability assay,BAO:0010098,
x ray powder diffraction,CHMO:0000158,A method for determining structure by directing a beam of X-rays at a powdered solid sample and detecting the positions and intensities of the diffracted X-rays as a pattern of spots on a photographic plate.
differential scanning calorimetry ,ERO:0001615,A calorimetry technique in which the difference in the amount of heat required to increase the temperature of a sample and reference is measured as a function of temperature. Both the sample and reference are maintained at nearly the same temperature throughout the experiment.
thermogravimetric analysis ,CHMO:0002121,"A piece of apparatus, consisting of a quartz or alumina chamber, a balance, a sample pan and a heating mechanism, which is used to record the mass of a sample as a function of increasing temperature."
rotational rheometry,,"Analytical technique for measuring/comparing the viscosity, viscoelastic properties (e.g. G’, G”, tan δ), crosslinking, molecular weight and transient properties (e.g. creep, modulus) for a wide range of samples including fluids, semi-solids, and solids."
Raman microscopy,CHMO:0000056,The collection of spatially resolved Raman spectra of a sample during optical microscopy.
laser diffraction analysis,,A techique used to evalute  droplet and particle size distribution through light diffraction patterns. 
dynamic light scattering,CHMO:0000167,A method for determining the size distribution of a sample of small particles in solution by illuminating the sample with a light source (usually a laser) and measuring the time-dependent fluctuations in the intensity of the scattered light caused by Brownian motion
contact angle measurement,,Measurement of a static and dynamic contact angle of a liquid drop on a solid surface in orer to asssess surface wettability
laser Doppler electrophoresis,,Particle motion under an applied electric field in order to assess particle Zeta potential.
dissolution profile,MI:2113,"The rate of dissolution is a key target for controlling the duration of a drug's effect, and as such, several dosage forms that contain the same active ingredient may be available, differing only in the rate of dissolution. If a drug is supplied in a form that is not readily dissolved, the drug may be released more gradually over time with a longer duration of action. Having a longer duration of action may improve compliance since the medication will not have to be taken as often. Additionally, slow-release dosage forms may maintain concentrations within an acceptable therapeutic range over a long period of time, as opposed to quick-release dosage forms which may result in sharper peaks and troughs in serum concentrations."
solid state peptide synthesis,,
C. elegans  studies,,"These assays are used to determine the cute and sub-acute toxic effects of compounds. They include the viability, lifespan, health span, reproduction, and development of worms. The evaluation of the motility, pharyngeal function, and synaptic transmission can also be done. "
